{"$schema":"https://json-schema.org/draft/2020-12/schema","type":"object","additionalProperties":false,"required":["$schema","defaultDisposition","operatorOnly","blockedConditions","requiredChecks"],"properties":{"$schema":{"const":"../schemas/extension-service-policy.schema.json"},"defaultDisposition":{"const":"deny"},"operatorOnly":{"const":true},"blockedConditions":{"type":"array","minItems":1,"uniqueItems":true,"items":{"enum":["git-source","unknown-lifecycle-script","native-binary","browser-driver","background-service","oauth","paid-api","allowBuilds"]}},"requiredChecks":{"type":"array","minItems":1,"uniqueItems":true,"items":{"enum":["exact-version","tarball","integrity","package-scripts","license","backup","rollback"]}}}}
